{"activationAuthorized":false,"activeSnapshotBinding":{"authoritySchema":2,"generation":1,"id":"curation-program-acceptance-authority-v2-g000001","path":"snapshots/v2/g000001.json","sha256":"613ba54b4d944ebe1a497fcf22fc22e32528e2a0fcbd935b7d304c1bd34dcde1"},"activeTransitionBinding":{"authoritySchema":1,"generation":null,"id":"curation-program-acceptance-authority-v2-g000002-to-g000001-rollback","path":"transitions/g000002-to-g000001-rollback.json","sha256":"898e833607ed52766b4c8a93fd7feb71cbaea48f9564ec8146bf1849b890c8aa"},"authoritySeriesId":"curation-program-acceptance-authority-v2","executionCounters":{"accountConnectionCount":0,"candidateExecutionCount":0,"consumerMutationCount":0,"enableCount":0,"installCount":0,"managerMutationCount":0,"modelRequestCount":0,"pluginExecutionCount":0,"productionActivationCount":0,"publicationCount":0,"releaseCount":0},"id":"curation-program-acceptance-current-selector-v1","programPlanBinding":{"authoritySchema":2,"generation":1,"id":"curation-program-plan-v2","path":"curation-program-plan-v2.json","sha256":"00094a975f036639e55ef54a21d34ea704393ed302f31da858b7a140b21d1d12"},"schema":1,"selectionMode":"rehearsal-candidate"}
